{
  "$schema": "https://json-schema.org/draft/2020-12/schema",
  "title": "Track",
  "description": "The Follower's state for one cover that follows an item across frames and scrolls. Veil contract v1.0. Units: positions and sizes are integer screen pixels with the origin at the top-left of the display in its current orientation (x grows right, y grows down); times are integer milliseconds on one monotonic clock (Android SystemClock.uptimeMillis; replays use a virtual clock in the same unit); fingerprints are L2-normalised vectors stored as float16.",
  "type": "object",
  "additionalProperties": false,
  "properties": {
    "contractVersion": {
      "type": "string",
      "const": "1.0",
      "description": "Contract version this object follows."
    },
    "trackId": {
      "type": "integer",
      "minimum": 1,
      "description": "Assigned in creation order (deterministic tie-breaking)."
    },
    "conceptId": {
      "type": "string",
      "pattern": "^[a-z0-9][a-z0-9._-]{0,63}$",
      "description": "The concept being followed."
    },
    "layer": {
      "type": "integer",
      "enum": [
        1,
        2
      ],
      "description": "1 is the always-on safety layer, 2 is the user's own list."
    },
    "rect": {
      "$ref": "rect.schema.json",
      "description": "Current position after scroll shifts."
    },
    "state": {
      "type": "string",
      "enum": [
        "tentative",
        "confirmed",
        "parked",
        "released"
      ],
      "description": "Lifecycle state of the track."
    },
    "sightings": {
      "type": "integer",
      "minimum": 0,
      "description": "Number of times the item was seen."
    },
    "firstSeenMs": {
      "type": "integer",
      "minimum": 0,
      "description": "Time of the first sighting."
    },
    "lastSeenMs": {
      "type": "integer",
      "minimum": 0,
      "description": "Time of the latest sighting."
    },
    "holdUntilMs": {
      "type": "integer",
      "minimum": 0,
      "description": "The cover is kept at least until this time."
    },
    "maxHoldUntilMs": {
      "type": "integer",
      "minimum": 0,
      "description": "The cover is never kept past this time."
    },
    "parkedUntilMs": {
      "type": "integer",
      "minimum": 0,
      "description": "When a parked track expires."
    },
    "selfCaptureFraction": {
      "type": "number",
      "minimum": 0,
      "maximum": 1,
      "description": "Share of the item hidden by Veil's own covers."
    },
    "peeked": {
      "type": "boolean",
      "description": "True while the user is peeking under the cover."
    },
    "scope": {
      "type": "string",
      "enum": [
        "object",
        "wholeElement"
      ],
      "description": "Cover only the object, or the whole element around it."
    },
    "lastFindingId": {
      "type": "string",
      "pattern": "^[A-Za-z0-9][A-Za-z0-9._:-]{0,63}$",
      "description": "The finding that last confirmed the track."
    }
  },
  "required": [
    "contractVersion",
    "trackId",
    "conceptId",
    "layer",
    "rect",
    "state",
    "sightings",
    "firstSeenMs",
    "lastSeenMs",
    "holdUntilMs",
    "maxHoldUntilMs",
    "selfCaptureFraction",
    "peeked",
    "scope"
  ]
}
