{
  "contractVersion": "1.0",
  "trackId": 4,
  "conceptId": "spiders",
  "layer": 2,
  "rect": {
    "x": 0,
    "y": -300,
    "w": 1440,
    "h": 900
  },
  "state": "parked",
  "sightings": 6,
  "firstSeenMs": 93190000,
  "lastSeenMs": 93203000,
  "holdUntilMs": 93203500,
  "maxHoldUntilMs": 93220000,
  "parkedUntilMs": 93213000,
  "selfCaptureFraction": 0.1,
  "peeked": false,
  "scope": "wholeElement"
}
